[
    {
        "code": "TPE050/PN6/BR",
        "sdr": 26,
        "pn_class": "PN6",
        "dn_mm": 50,
        "wall_mm": 2.0,
        "inner_diameter_mm": 46.00,
        "weight_per_meter": 0.32
    },
    {
        "code": "TPE063/PN6/BR",
        "sdr": 26,
        "pn_class": "PN6",
        "dn_mm": 63,
        "wall_mm": 2.5,
        "inner_diameter_mm": 58.00,
        "weight_per_meter": 0.50
    },
    {
        "code": "TPE075/PN6/BR",
        "sdr": 26,
        "pn_class": "PN6",
        "dn_mm": 75,
        "wall_mm": 2.9,
        "inner_diameter_mm": 69.20,
        "weight_per_meter": 0.67
    },
    {
        "code": "TPE090/PN6/BR",
        "sdr": 26,
        "pn_class": "PN6",
        "dn_mm": 90,
        "wall_mm": 3.5,
        "inner_diameter_mm": 83.00,
        "weight_per_meter": 0.97
    },
    {
        "code": "TPE110/PN6/BR",
        "sdr": 26,
        "pn_class": "PN6",
        "dn_mm": 110,
        "wall_mm": 4.2,
        "inner_diameter_mm": 101.60,
        "weight_per_meter": 1.42
    },
    {
        "code": "TPE125/PN6/BR",
        "sdr": 26,
        "pn_class": "PN6",
        "dn_mm": 125,
        "wall_mm": 4.8,
        "inner_diameter_mm": 115.40,
        "weight_per_meter": 1.84
    },
    {
        "code": "TPE140/PN6/BR",
        "sdr": 26,
        "pn_class": "PN6",
        "dn_mm": 140,
        "wall_mm": 5.4,
        "inner_diameter_mm": 129.20,
        "weight_per_meter": 2.32
    },
    {
        "code": "TPE160/PN6/BR",
        "sdr": 26,
        "pn_class": "PN6",
        "dn_mm": 160,
        "wall_mm": 6.2,
        "inner_diameter_mm": 147.60,
        "weight_per_meter": 3.05
    },
    {
        "code": "TPE180/PN6/BR",
        "sdr": 26,
        "pn_class": "PN6",
        "dn_mm": 180,
        "wall_mm": 6.9,
        "inner_diameter_mm": 166.20,
        "weight_per_meter": 3.81
    },
    {
        "code": "TPE200/PN6/BR",
        "sdr": 26,
        "pn_class": "PN6",
        "dn_mm": 200,
        "wall_mm": 7.7,
        "inner_diameter_mm": 184.60,
        "weight_per_meter": 4.73
    },
    {
        "code": "TPE225/PN6/BR",
        "sdr": 26,
        "pn_class": "PN6",
        "dn_mm": 225,
        "wall_mm": 8.6,
        "inner_diameter_mm": 207.80,
        "weight_per_meter": 5.94
    },
    {
        "code": "TPE250/PN6/BR",
        "sdr": 26,
        "pn_class": "PN6",
        "dn_mm": 250,
        "wall_mm": 9.6,
        "inner_diameter_mm": 230.80,
        "weight_per_meter": 7.37
    },
    {
        "code": "TPE280/PN6/BR",
        "sdr": 26,
        "pn_class": "PN6",
        "dn_mm": 280,
        "wall_mm": 10.7,
        "inner_diameter_mm": 258.60,
        "weight_per_meter": 9.20
    },
    {
        "code": "TPE315/PN6/BR",
        "sdr": 26,
        "pn_class": "PN6",
        "dn_mm": 315,
        "wall_mm": 12.1,
        "inner_diameter_mm": 290.80,
        "weight_per_meter": 11.71
    },
    {
        "code": "TPE355/PN6/BR",
        "sdr": 26,
        "pn_class": "PN6",
        "dn_mm": 355,
        "wall_mm": 13.6,
        "inner_diameter_mm": 327.80,
        "weight_per_meter": 14.83
    },
    {
        "code": "TPE400/PN6/BR",
        "sdr": 26,
        "pn_class": "PN6",
        "dn_mm": 400,
        "wall_mm": 15.3,
        "inner_diameter_mm": 369.40,
        "weight_per_meter": 18.80
    },
    {
        "code": "TPE450/PN6/BR",
        "sdr": 26,
        "pn_class": "PN6",
        "dn_mm": 450,
        "wall_mm": 17.2,
        "inner_diameter_mm": 415.60,
        "weight_per_meter": 23.78
    },
    {
        "code": "TPE500/PN6/BR",
        "sdr": 26,
        "pn_class": "PN6",
        "dn_mm": 500,
        "wall_mm": 19.1,
        "inner_diameter_mm": 461.80,
        "weight_per_meter": 29.34
    },
    {
        "code": "TPE560/PN6/BR",
        "sdr": 26,
        "pn_class": "PN6",
        "dn_mm": 560,
        "wall_mm": 21.4,
        "inner_diameter_mm": 517.20,
        "weight_per_meter": 36.81
    },
    {
        "code": "TPE630/PN6/BR",
        "sdr": 26,
        "pn_class": "PN6",
        "dn_mm": 630,
        "wall_mm": 24.1,
        "inner_diameter_mm": 581.80,
        "weight_per_meter": 46.64
    },
    {
        "code": "TPE710/PN6/BR",
        "sdr": 26,
        "pn_class": "PN6",
        "dn_mm": 710,
        "wall_mm": 27.2,
        "inner_diameter_mm": 655.60,
        "weight_per_meter": 59.32
    },
    {
        "code": "TPE800/PN6/BR",
        "sdr": 26,
        "pn_class": "PN6",
        "dn_mm": 800,
        "wall_mm": 30.6,
        "inner_diameter_mm": 738.80,
        "weight_per_meter": 75.19
    },
    {
        "code": "TPE050/PN8/BR",
        "sdr": 21,
        "pn_class": "PN8",
        "dn_mm": 50,
        "wall_mm": 2.4,
        "inner_diameter_mm": 45.20,
        "weight_per_meter": 0.38
    },
    {
        "code": "TPE063/PN8/BR",
        "sdr": 21,
        "pn_class": "PN8",
        "dn_mm": 63,
        "wall_mm": 3.0,
        "inner_diameter_mm": 57.00,
        "weight_per_meter": 0.59
    },
    {
        "code": "TPE075/PN8/BR",
        "sdr": 21,
        "pn_class": "PN8",
        "dn_mm": 75,
        "wall_mm": 3.6,
        "inner_diameter_mm": 67.80,
        "weight_per_meter": 0.82
    },
    {
        "code": "TPE090/PN8/BR",
        "sdr": 21,
        "pn_class": "PN8",
        "dn_mm": 90,
        "wall_mm": 4.3,
        "inner_diameter_mm": 81.40,
        "weight_per_meter": 1.18
    },
    {
        "code": "TPE110/PN8/BR",
        "sdr": 21,
        "pn_class": "PN8",
        "dn_mm": 110,
        "wall_mm": 5.3,
        "inner_diameter_mm": 99.40,
        "weight_per_meter": 1.77
    },
    {
        "code": "TPE125/PN8/BR",
        "sdr": 21,
        "pn_class": "PN8",
        "dn_mm": 125,
        "wall_mm": 6.0,
        "inner_diameter_mm": 113.00,
        "weight_per_meter": 2.28
    },
    {
        "code": "TPE140/PN8/BR",
        "sdr": 21,
        "pn_class": "PN8",
        "dn_mm": 140,
        "wall_mm": 6.7,
        "inner_diameter_mm": 126.60,
        "weight_per_meter": 2.85
    },
    {
        "code": "TPE160/PN8/BR",
        "sdr": 21,
        "pn_class": "PN8",
        "dn_mm": 160,
        "wall_mm": 7.7,
        "inner_diameter_mm": 144.60,
        "weight_per_meter": 3.75
    },
    {
        "code": "TPE180/PN8/BR",
        "sdr": 21,
        "pn_class": "PN8",
        "dn_mm": 180,
        "wall_mm": 8.6,
        "inner_diameter_mm": 162.80,
        "weight_per_meter": 4.71
    },
    {
        "code": "TPE200/PN8/BR",
        "sdr": 21,
        "pn_class": "PN8",
        "dn_mm": 200,
        "wall_mm": 9.6,
        "inner_diameter_mm": 180.80,
        "weight_per_meter": 5.84
    },
    {
        "code": "TPE225/PN8/BR",
        "sdr": 21,
        "pn_class": "PN8",
        "dn_mm": 225,
        "wall_mm": 10.8,
        "inner_diameter_mm": 203.40,
        "weight_per_meter": 7.39
    },
    {
        "code": "TPE250/PN8/BR",
        "sdr": 21,
        "pn_class": "PN8",
        "dn_mm": 250,
        "wall_mm": 11.9,
        "inner_diameter_mm": 226.20,
        "weight_per_meter": 9.05
    },
    {
        "code": "TPE280/PN8/BR",
        "sdr": 21,
        "pn_class": "PN8",
        "dn_mm": 280,
        "wall_mm": 13.4,
        "inner_diameter_mm": 253.20,
        "weight_per_meter": 11.41
    },
    {
        "code": "TPE315/PN8/BR",
        "sdr": 21,
        "pn_class": "PN8",
        "dn_mm": 315,
        "wall_mm": 15.0,
        "inner_diameter_mm": 285.00,
        "weight_per_meter": 14.37
    },
    {
        "code": "TPE355/PN8/BR",
        "sdr": 21,
        "pn_class": "PN8",
        "dn_mm": 355,
        "wall_mm": 16.9,
        "inner_diameter_mm": 321.20,
        "weight_per_meter": 18.25
    },
    {
        "code": "TPE400/PN8/BR",
        "sdr": 21,
        "pn_class": "PN8",
        "dn_mm": 400,
        "wall_mm": 19.1,
        "inner_diameter_mm": 361.80,
        "weight_per_meter": 23.24
    },
    {
        "code": "TPE450/PN8/BR",
        "sdr": 21,
        "pn_class": "PN8",
        "dn_mm": 450,
        "wall_mm": 21.5,
        "inner_diameter_mm": 407.00,
        "weight_per_meter": 29.42
    },
    {
        "code": "TPE500/PN8/BR",
        "sdr": 21,
        "pn_class": "PN8",
        "dn_mm": 500,
        "wall_mm": 23.9,
        "inner_diameter_mm": 452.20,
        "weight_per_meter": 36.34
    },
    {
        "code": "TPE560/PN8/BR",
        "sdr": 21,
        "pn_class": "PN8",
        "dn_mm": 560,
        "wall_mm": 26.7,
        "inner_diameter_mm": 506.60,
        "weight_per_meter": 45.48
    },
    {
        "code": "TPE630/PN8/BR",
        "sdr": 21,
        "pn_class": "PN8",
        "dn_mm": 630,
        "wall_mm": 30.0,
        "inner_diameter_mm": 570.00,
        "weight_per_meter": 57.49
    },
    {
        "code": "TPE710/PN8/BR",
        "sdr": 21,
        "pn_class": "PN8",
        "dn_mm": 710,
        "wall_mm": 33.9,
        "inner_diameter_mm": 642.20,
        "weight_per_meter": 73.20
    },
    {
        "code": "TPE800/PN8/BR",
        "sdr": 21,
        "pn_class": "PN8",
        "dn_mm": 800,
        "wall_mm": 38.1,
        "inner_diameter_mm": 723.80,
        "weight_per_meter": 92.71
    },
    {
        "code": "TPE020/PN10/BR",
        "sdr": 17,
        "pn_class": "PN10",
        "dn_mm": 20,
        "wall_mm": 1.18,
        "inner_diameter_mm": 17.64,
        "weight_per_meter": 0.07
    },
    {
        "code": "TPE025/PN10/BR",
        "sdr": 17,
        "pn_class": "PN10",
        "dn_mm": 25,
        "wall_mm": 2.0,
        "inner_diameter_mm": 21.00,
        "weight_per_meter": 0.11
    },
    {
        "code": "TPE032/PN10/BR",
        "sdr": 17,
        "pn_class": "PN10",
        "dn_mm": 32,
        "wall_mm": 2.0,
        "inner_diameter_mm": 28.00,
        "weight_per_meter": 0.20
    },
    {
        "code": "TPE040/PN10/BR",
        "sdr": 17,
        "pn_class": "PN10",
        "dn_mm": 40,
        "wall_mm": 2.4,
        "inner_diameter_mm": 35.20,